{
  "schemaVersion": "0.1.0",
  "id": "kpr-5786219c-c2a8-4c0f-8e3c-4f5dd952ffed",
  "title": "Optional conclusion-first research briefs",
  "status": "verification_passed",
  "problem": "Research Brief readers may need the conclusion before the supporting context.",
  "scope": [
    "research-brief",
    "summary-layout",
    "user-preference"
  ],
  "expectedBehavior": [
    "Users can opt into a conclusion-first layout.",
    "Evidence and source links remain visible.",
    "The preference is saved only after explicit confirmation."
  ],
  "acceptanceCriteria": [
    "Conclusion renders before evidence when the option is enabled.",
    "All source links remain attached.",
    "The existing public default remains unchanged.",
    "Removing the option restores reference behavior."
  ],
  "nonGoals": [
    "Do not make conclusion-first the public default.",
    "Do not change non-Research-Brief applications.",
    "Do not adopt the contributor's local code directly."
  ],
  "protectedInvariants": [
    "Source links remain visible and attached to evidence.",
    "The public default does not change without Maintainer approval.",
    "Private preferences are not submitted automatically.",
    "Project Agent completion requires verifier evidence.",
    "Final public adoption belongs to the Maintainer."
  ],
  "knowledgeClaims": [
    {
      "createdBy": {
        "id": "agent-user-side",
        "type": "agent",
        "label": "User-side Agent",
        "role": "user-side"
      },
      "derivedFrom": [
        {
          "id": "source-user-request",
          "type": "human_statement",
          "label": "Contributor request",
          "timestamp": "2026-08-14T08:57:03.614Z"
        },
        {
          "id": "source-agent-extraction",
          "type": "agent_extraction",
          "label": "User-side Agent extraction",
          "timestamp": "2026-08-14T08:57:03.614Z"
        },
        {
          "id": "source-local-workspace",
          "type": "workspace",
          "label": "Verified local overlay",
          "timestamp": "2026-08-14T08:57:03.614Z"
        },
        {
          "id": "source-contributor-correction-claim-problem",
          "type": "decision",
          "label": "Contributor correction of Agent extraction",
          "timestamp": "2026-08-14T08:57:03.614Z"
        }
      ],
      "agentGenerated": true,
      "confidence": "high",
      "status": "human_attested",
      "conflictsWith": [],
      "supersedes": [],
      "limitations": [
        "Verified in the Research Brief reference scenario only."
      ],
      "id": "claim-problem",
      "type": "problem",
      "statement": "In this Research Brief scenario, the current layout delays the decision-relevant conclusion until after the supporting context.",
      "scope": [
        "research-brief",
        "summary-layout"
      ],
      "evidenceRefs": [
        "evidence-layout-order"
      ],
      "humanAttestation": {
        "actor": {
          "id": "human-contributor",
          "type": "human",
          "label": "You / Contributor",
          "role": "contributor"
        },
        "statement": "I confirm that these claims accurately represent my request and local verification. I reviewed the submission scope and excluded private information.",
        "attestedAt": "2026-08-14T08:57:03.614Z",
        "scope": [
          "problem",
          "expected_behavior",
          "constraints",
          "local_evidence"
        ]
      }
    },
    {
      "createdBy": {
        "id": "agent-user-side",
        "type": "agent",
        "label": "User-side Agent",
        "role": "user-side"
      },
      "derivedFrom": [
        {
          "id": "source-user-request",
          "type": "human_statement",
          "label": "Contributor request",
          "timestamp": "2026-08-14T08:57:03.614Z"
        },
        {
          "id": "source-agent-extraction",
          "type": "agent_extraction",
          "label": "User-side Agent extraction",
          "timestamp": "2026-08-14T08:57:03.614Z"
        },
        {
          "id": "source-local-workspace",
          "type": "workspace",
          "label": "Verified local overlay",
          "timestamp": "2026-08-14T08:57:03.614Z"
        }
      ],
      "agentGenerated": true,
      "confidence": "high",
      "status": "human_attested",
      "conflictsWith": [],
      "supersedes": [],
      "limitations": [
        "Verified in the Research Brief reference scenario only."
      ],
      "id": "claim-expected-order",
      "type": "expected_behavior",
      "statement": "A reader can choose a conclusion-first layout with supporting evidence immediately after it.",
      "scope": [
        "research-brief",
        "summary-layout"
      ],
      "evidenceRefs": [
        "evidence-layout-order"
      ],
      "humanAttestation": {
        "actor": {
          "id": "human-contributor",
          "type": "human",
          "label": "You / Contributor",
          "role": "contributor"
        },
        "statement": "I confirm that these claims accurately represent my request and local verification. I reviewed the submission scope and excluded private information.",
        "attestedAt": "2026-08-14T08:57:03.614Z",
        "scope": [
          "problem",
          "expected_behavior",
          "constraints",
          "local_evidence"
        ]
      }
    },
    {
      "createdBy": {
        "id": "agent-user-side",
        "type": "agent",
        "label": "User-side Agent",
        "role": "user-side"
      },
      "derivedFrom": [
        {
          "id": "source-user-request",
          "type": "human_statement",
          "label": "Contributor request",
          "timestamp": "2026-08-14T08:57:03.614Z"
        },
        {
          "id": "source-agent-extraction",
          "type": "agent_extraction",
          "label": "User-side Agent extraction",
          "timestamp": "2026-08-14T08:57:03.614Z"
        },
        {
          "id": "source-local-workspace",
          "type": "workspace",
          "label": "Verified local overlay",
          "timestamp": "2026-08-14T08:57:03.614Z"
        }
      ],
      "agentGenerated": true,
      "confidence": "high",
      "status": "human_attested",
      "conflictsWith": [],
      "supersedes": [],
      "limitations": [
        "Verified in the Research Brief reference scenario only."
      ],
      "id": "claim-preserve-sources",
      "type": "constraint",
      "statement": "Changing the layout must not remove evidence or source links.",
      "scope": [
        "research-brief",
        "sources"
      ],
      "evidenceRefs": [
        "evidence-source-preservation"
      ],
      "humanAttestation": {
        "actor": {
          "id": "human-contributor",
          "type": "human",
          "label": "You / Contributor",
          "role": "contributor"
        },
        "statement": "I confirm that these claims accurately represent my request and local verification. I reviewed the submission scope and excluded private information.",
        "attestedAt": "2026-08-14T08:57:03.614Z",
        "scope": [
          "problem",
          "expected_behavior",
          "constraints",
          "local_evidence"
        ]
      }
    },
    {
      "createdBy": {
        "id": "agent-user-side",
        "type": "agent",
        "label": "User-side Agent",
        "role": "user-side"
      },
      "derivedFrom": [
        {
          "id": "source-user-request",
          "type": "human_statement",
          "label": "Contributor request",
          "timestamp": "2026-08-14T08:57:03.614Z"
        },
        {
          "id": "source-agent-extraction",
          "type": "agent_extraction",
          "label": "User-side Agent extraction",
          "timestamp": "2026-08-14T08:57:03.614Z"
        },
        {
          "id": "source-local-workspace",
          "type": "workspace",
          "label": "Verified local overlay",
          "timestamp": "2026-08-14T08:57:03.614Z"
        }
      ],
      "agentGenerated": true,
      "confidence": "high",
      "status": "human_attested",
      "conflictsWith": [],
      "supersedes": [],
      "limitations": [
        "Verified in the Research Brief reference scenario only."
      ],
      "id": "claim-remember-preference",
      "type": "intent",
      "statement": "Remember the conclusion-first layout after the user explicitly confirms it.",
      "scope": [
        "user-preference"
      ],
      "evidenceRefs": [
        "evidence-reversible-overlay"
      ],
      "humanAttestation": {
        "actor": {
          "id": "human-contributor",
          "type": "human",
          "label": "You / Contributor",
          "role": "contributor"
        },
        "statement": "I confirm that these claims accurately represent my request and local verification. I reviewed the submission scope and excluded private information.",
        "attestedAt": "2026-08-14T08:57:03.614Z",
        "scope": [
          "problem",
          "expected_behavior",
          "constraints",
          "local_evidence"
        ]
      }
    },
    {
      "createdBy": {
        "id": "agent-user-side",
        "type": "agent",
        "label": "User-side Agent",
        "role": "user-side"
      },
      "derivedFrom": [
        {
          "id": "source-user-request",
          "type": "human_statement",
          "label": "Contributor request",
          "timestamp": "2026-08-14T08:57:03.614Z"
        },
        {
          "id": "source-agent-extraction",
          "type": "agent_extraction",
          "label": "User-side Agent extraction",
          "timestamp": "2026-08-14T08:57:03.614Z"
        },
        {
          "id": "source-local-workspace",
          "type": "workspace",
          "label": "Verified local overlay",
          "timestamp": "2026-08-14T08:57:03.614Z"
        }
      ],
      "agentGenerated": true,
      "confidence": "high",
      "status": "human_attested",